<?xml version = "1.0" encoding = "UTF-8"?>
<!DOCTYPE libreria SYSTEM "option.dtd">
<libreria>
  <pelicula id="1">
    <director>Maria</director>
    <año>2018</año>
    <duracion>120</duracion>
    <actores>
      <actor>Matt</actor>
    </actores>
    <genero>Drama</genero>
    <nacionalidad>Española</nacionalidad>
  </pelicula>
</libreria>
